{
  "$schema": "https://json-schema.org/draft/2020-12/schema",
  "$id": "https://example.com/schemas/policy-extension-registry.schema.v1.json",
  "title": "Policy Extension Registry",
  "type": "object",
  "additionalProperties": false,
  "required": [
    "version",
    "enabled_by_default",
    "layer_contract",
    "entrypoints",
    "determinism",
    "idle_on_missing_manifests"
  ],
  "properties": {
    "version": { "type": "string", "enum": ["v1"] },
    "enabled_by_default": { "type": "boolean" },
    "layer_contract": {
      "type": "object",
      "additionalProperties": false,
      "required": ["write_roots_allowlist"],
      "properties": {
        "write_roots_allowlist": { "type": "array", "items": { "type": "string" } },
        "read_roots_allowlist": { "type": "array", "items": { "type": "string" } },
        "notes": { "type": "array", "items": { "type": "string" } }
      }
    },
    "entrypoints": {
      "type": "object",
      "additionalProperties": false,
      "required": ["ops", "kernel_api_actions", "cockpit_sections"],
      "properties": {
        "ops": { "type": "array", "items": { "type": "string" } },
        "kernel_api_actions": { "type": "array", "items": { "type": "string" } },
        "cockpit_sections": { "type": "array", "items": { "type": "string" } }
      }
    },
    "determinism": {
      "type": "object",
      "additionalProperties": false,
      "required": ["stable_sort", "content_hash_required", "version_required"],
      "properties": {
        "stable_sort": { "type": "boolean" },
        "content_hash_required": { "type": "boolean" },
        "version_required": { "type": "boolean" }
      }
    },
    "idle_on_missing_manifests": { "type": "boolean" }
  }
}
